"doc_id","text"
"nfl-news","The Denver Broncos are in prime position entering Thursday's draft to grab an impact player with the No. 5 overall pick. Cornerback Chris Harris, however, hopes the player isn't taking snaps from under center."
"nfl-news","The Los Angeles Rams are making sure two of their standout players remain under contract through 2019, picking up the fifth-year contract options for Todd Gurley and Marcus Peters."
"polygon","Take back control of the camera"
"polygon","Enter the Witchwood with four new heroes"
"polygon","How do you fix the black border and bars around the screen? It seems to only show up in God of War and the in-game display settings don’t mention a thing. We have a fix."
"polygon","Suros Regime is back!"
"polygon","A new adventure in being adorable"
"polygon","Players will have a lot more to do"
"polygon","The latest update for the PlayerUnknown’s Battlegrounds for iOS and Android is live and adds a new 28-player Arcade mode as well as a training grounds with a shooting range."
"polygon","A PlayStation collection of amazing games — for $15"
"polygon","Free-to-play survival game will kick off with an open beta"
"polygon","The Solo: A Star Wars Story actor is signed for more films"
"recode","Two ways to look at NFLX’s amazing run."
"recode","In my opinion, bitcoin a colossal pump-and-dump scheme, the likes of which the world has never seen. In a pump-and-dump game, promoters “pump” up the price of a security creating a speculative frenzy, then “dump” some of their holdings at artificially high prices. And some cryptocurrencies are pure frauds. Ernst & Young estimates that 10 percent of the money raised for initial coin offerings has been stolen."
"recode","Back in the fall, Amazon unveiled a slew of new voice-controlled Alexa devices, each seemingly geared toward a different use case. Here’s one more."
"recode","All of Twitter’s key numbers were up last quarter, and now so is the stock."
"recode","“These were dangerous ideas that were going to destroy the computing industry.”"
"recode","Uber, Postmates, DoorDash and Deliv — but not the most popular grocery delivery startup in the U.S."
"recode","Snap dramatically drove up office rents. Now, the company is headed to Santa Monica, leaving behind a collection of offices across Venice that have benefitted from million of dollars worth of renovations and upgrades."
"recode","User Stories are headed to the Discover page, which raises a number of questions about Snap’s recent redesign."
"recode","We answer questions about SpaceX, Blue Origin and more."
"recode","What makes this year’s F8 conference different than any in Facebook’s history is that the company just spent the past six weeks clamping down on much of the data that these developers have come to rely on, amidst a massive privacy scandal."
"reddit-r-all","4736 points and 101 comments so far on reddit"
"reddit-r-all",NA
"reddit-r-all","Imgur: The magic of the Internet"
"reddit-r-all","The TV talker has said that self-proclaimed fixer Michael Cohen had been helping him with real-estate matters."
"reddit-r-all","3143 points and 122 comments so far on reddit"
"reddit-r-all",NA
"reddit-r-all","Imgur: The magic of the Internet"
"reddit-r-all","4631 votes and 80 so far on reddit"
"reddit-r-all","Imgur"
"reddit-r-all","Videos show protesters bravely defying the country's Islamic law, which requires women to cover their hair in public, as they walk through cities like the capital Tehran and Shiraz."
"reuters","The U.S. government is conducting an intensive examination of alleged atrocities against Myanmar's Rohingya Muslims, documenting accusations of murder, rape, beatings and other possible offenses in an investigation that could be used to prosecute Myanmar's military for crimes against humanity, U.S. officials told Reuters."
"reuters","President Donald Trump's administration goes before the U.S. Supreme Court on Wednesday to defend the legality of his travel ban targeting people from several Muslim-majority countries, one of the most contentious actions of his presidency."
"reuters","The recent detente between North and South Korea has given new life to talk of unification for the two countries divided since the 1950s."
"reuters","A judge in Myanmar will rule next week on whether a police captain was credible when he testified that two Reuters reporters were framed, after prosecutors argued on Wednesday that the officer should be declared an unreliable witness."
"reuters","Twitter Inc (TWTR.N) reported its second profitable quarter on Wednesday and topped Wall Street estimates for revenue and monthly active users, as advertisers in Asia and other markets outside the United States embraced its video ads."
"reuters","It is mid-morning on a weekday yet all that can be heard in the once-bustling corridors of the Orlando Garcia state primary school is the swish of palm trees outside in the wind."
"reuters","The Kremlin says it has nothing to do with Russian civilians fighting in Syria but on three recent occasions groups of men flying in from Damascus headed straight to a defense ministry base in Molkino, Reuters reporters witnessed."
"reuters","Iran's president poured scorn on Wednesday on U.S. and European discussions over Tehran's nuclear agreement, and dismissed Donald Trump as a ""tradesman"" who lacked the qualifications to deal with a complex international pact."
"reuters","A Danish court sentenced Danish inventor Peter Madsen to life in prison on Wednesday for murdering and dismembering a Swedish journalist aboard his homemade submarine in Copenhagen's harbor in August 2017."
"reuters","Sky (SKYB.L) withdrew its recommendation of Rupert Murdoch's contested bid for the European pay-TV group after rival Comcast (CMCSA.O) submitted a higher, 22 billion-pound ($31 billion) cash offer on Wednesday."
"talksport","Liverpool legend Graeme Souness is confident the Reds have done enough to progress to the Champions League final after their 5-2 first leg win over Roma. The Reds’ Holy Trinity of Mohamed Salah, Roberto Firmino and Sadio Mane were too hot to handle for the Italian side, as Salah and Firmino each scored two goals while Mane added another in a breathtaking night at Anfield."
"talksport","Liverpool legend Steven Gerrard hailed Mohamed Salah as ‘the best player on the planet right now’ after leading Liverpool to a thrilling victory over Roma in the Champions League. The ‘Egyptian King’ destroyed his former team at Anfield, with two goals and two assists in a 5-2 win which has put the Reds firmly in the driving seat of their semi-final tie."
"talksport","Arsene Wenger has revealed he has no plans to retire from management when he leaves Arsenal at the end of the season, and insists he will have no say in the club’s search for his successor. The Frenchman is hoping to end his 22-year Gunners reign with a trophy and is preparing his side for the first leg of their Europa League semi-final against Atletico Madrid."
"talksport","A team-up between Arsenal legends Patrick Vieira and Dennis Bergkamp would be the ‘perfect’ replacement for Arsene Wenger, Sol Campbell has told talkSPORT. The Gunners are searching for a new manager for the first time in 22 years after 68-year-old Wenger revealed he will leave the club at the end of the season."
"talksport","Merseyside Police have arrested two men on suspicion of attempted murder after a Liverpool supporter was seriously injured before the Champions League game with Roma at Anfield on Tuesday night. The incident occured outside the Albert Pub, where fans were gathering ahead of kick-off, and has left a 53-year-old man in a criticial condition in hospital. A 25-year-old and 26-year-old - both from Rome -  have been arrested after police launched an operation to track down the assailants."
"talksport","Real Madrid winger Gareth Bale has said 'you can't rule anything out in football' in response to recent reports he could leave Real Madrid to join Bayern Munich this summer. The German champions have been linked with an interest in the Welsh superstar, as doubts over his future at the Bernabeu continue. Bale’s future has been the subject of speculation for several months and a return to the Premier League a possibility, with Manchester United and former club Tottenham said to be keen."
"talksport","WBO middleweight world champion Billy Joe Saunders claims he “knows” that one of his past opponents was cheating by using performance-enhancing drugs against him. The unbeaten 160lbs title-holder made the bold accusations ahead of his fight with Martin Murray on June 23. “I know I have boxed an opponent on some sort of drug. I know I have,” Saunders told Jim White on talkSPORT. “I would put my house down that he was on something when I boxed him. “I’m not stupid, I’ve been in this sport a long time. I can look at somebody and know what’s going on."
"talksport","John Terry could yet extend his playing career with Aston Villa, telling talkSPORT he will make a decision on his future in the summer. In a exclusive one-on-one interview with Jim White, the 37-year-old former Chelsea and England captain insisted his only focus right now is on helping Villa reach the Premier League."
"talksport","Brendan Rodgers has all the right credentials to make a great candidate for the Arsenal job, according to former Celtic and Scotland manager Gordon Strachan. The Gunners are searching for a new boss for the first time in 22 years after Arsene Wenger announced he will leave the north London club at the end of the season."
"techcrunch","Healing America’s broken healthcare industry has been at the top of the priority list for almost every politician, entrepreneur, and inventor for at least the past forty years. Costs continue to climb (roughly 5% this year) and spending is already 20% of the nation’s GDP. For the trilli…"
"techcrunch","A recently discovered programming error can make some crypto tokens susceptible to hackers . The exploit allows a hacker to pass an unusually high value to the exchange and get a ridiculous number of tokens in exchange, a problem that has caused the Okex exchange shut down all token trading includi…"
"techcrunch","Austin, Texas-based BigCommerce has completed a big round of funding. The growth stage startup, which builds e-commerce sites for Sony, Toyota and 60,000 other merchants, has raised $64 million to accelerate its business. The investment was led by Goldman Sachs, with participation from General Cata…"
"techcrunch","Another contender is throwing its hat into the ring to replace Uber in Southeast Asia after India’s Jugnoo, a startup that specializes in offering autorickshaws on-demand in India, revealed it plans to enter Singapore. Uber announced its exit from Southeast Asia last month in a deal that sees…"
"techcrunch","Twitter is making good on its pledge to fight the persistent problems of spam, bots, harassment, and misinformation that have plagued the social platform for years. Today, in its generally positive Q1 earnings report, the company announced that changes that it has made related to TweetDeck and its …"
"techcrunch","If you believe blockchains will proliferate in the coming years, it stands to reason that you will need some sort of mechanism to move information between them, a network of blockchains with bridges and processes for sharing information between entities. That is exactly what The Aion Network is pro…"
"techcrunch","This was nothing if not inevitable. Alexa’s steady home takeover just found its way into your kids’ rooms — and it’s doing so with a brightly colored case. Amazon just unveiled the Echo Dot Kids Edition — the first time the company’s popular smart speaker line has targeted children directly. From a…"
"techcrunch","In a briefing earlier this week, Amazon told TechCrunch that it was surprised by how Alexa has been embraced by families. But while the smart assistant isn’t exactly risqué (with a couple of notable exceptions), there are certainly things you don’t necessarily want your kid getting access to — shop…"
"techcrunch","Starling, the U.K. challenger bank founded by Anne Boden, continues to execute on its “marketplace banking” vision, adding integration with Aviva-backed online investment service Wealthify. Starling already has an existing partnership with digital investing service Wealthsimple — …"
"techcrunch","It looks like Twitter, the oft-beleaguered social network that’s still worth more than Snap, will still hold that status for a little longer after delivering a stronger-than-expected quarter this morning. Twitter’s monthly active users barely grew — though it did, indeed, grow — by arou…"
"techradar","Apple's iPhone-compatible in-dash experience"
"techradar","Drama on the production line"
"techradar","How aperture, focal length and focus control sharpness"
"techradar","Here's where to get Apple's iPhone 8 and 8 Plus in the US"
"techradar","A keyboard that puts advanced security right at your fingertips"
"techradar","Motorola is bringing 18:9 screens to its most popular phone series"
"the-economist","For the Communist Party, this could be a risk"
"the-economist","Muslim refugees are set to decline by 85%"
"the-economist","The role of technology is under attack"
"the-economist","That could free people to pursue more interesting careers"
"the-economist","Many internet services are free to consumers, but still valuable"
"the-economist","The Economist has launched the Open Future initiative to re-state the case for the values of classical liberalism—that is, political, economic and social freedom—to address the challenges of the 21st century."
"the-economist",NA
"the-economist","The president’s defenders say the judiciary should not examine his motives"
"the-economist","Expect a schoolyard black market in adult login-codes"
"the-economist","Turning exotic species into meals, pets and snake oil is a big international business"
"the-guardian-au","Scott Morrison will outline plans to forgo revenue intended to fund NDIS but says government can still fund program"
"the-guardian-au","Despite the sombre occasion and the cold of France, it’s clear a hobnobbing Malcolm Turnbull is having the time of his life"
"the-guardian-au","Andrew Wilkie says opponents of Van Diemen’s Land Company’s sale to Moon Lake Investments were ‘right all along’"
"the-guardian-au","Swedish journalist’s dismembered remains were found at sea after she failed to return from trip on Madsen’s submarine"
"the-guardian-au","Liam and Dijon Joseph say racial profiling is behind Met officers’ reaction to a friendly gesture"
"the-guardian-au","Leading researchers sign open letter saying privacy restrictions ‘likely to compound the real problem’"
"the-guardian-au","Publisher reports smaller than expected loss of £19m as benefits of tabloid switch filter through"
"the-guardian-au","Philippines cancels visa and gives nun 30 days to leave after president Rodrigo Duterte orders investigation"
"the-guardian-au","Humanitarian chief and special envoy warn of potential for another humanitarian catastrophe"
"the-guardian-au","Post appeared to connect the alleged killer with ‘incel’ movement, which has made sexual frustration the basis for a misogynistic online subculture"
"the-guardian-uk","Swedish journalist’s dismembered remains were found at sea after she failed to return from trip on Madsen’s submarine"
"the-guardian-uk","About 40 MPs form protective ring around Ruth Smeeth on way to activist’s expulsion hearing"
"the-guardian-uk","Labour leader lambasts Theresa May and ministers for failure to realise ‘hostile environment’ led to crisis"
"the-guardian-uk","Woman whose London flat has slumped in value is told she can pay back £10,000 of £95,000 loan"
"the-guardian-uk","Nine-month sentence described as ‘ridiculous’ by father of 17-year-old who posed no threat"
"the-guardian-uk","Post appeared to connect the alleged killer with ‘incel’ movement, which has made sexual frustration the basis for a misogynistic online subculture"
"the-guardian-uk","Finding solution to hard border problem can wait until autumn, says Brexit secretary"
"the-guardian-uk","Douglas Innes found not guilty of manslaughter of four sailors who died when boat capsized mid-Atlantic"
"the-guardian-uk","Club criticises ‘small minority’ as two held for attempted murder at Champions League semi-final"
"the-guardian-uk","Publisher reports smaller than expected loss of £19m as benefits of tabloid switch filter through"
"the-hindu","The Jodhpur police has enforced prohibitory orders, stopped entry of Asaram’s followers and evacuated his ashram to prevent any untoward incident."
"the-hindu","‘I couldn’t handle the pressure’, said Gambhir, whose team is at the bottom of the IPL table"
"the-hindu","Dr. Khan was lodged in Gorakhpur district jail in connection with the death of infants last August in the BRD hospital in Gorakhpur allegedly due to lack of oxygen."
"the-hindu","It was a “cynical murder” of a journalist who was performing her duties, the Copenhagen City Court said in its ruling."
"the-hindu","She also announced a study on male survivors of child sexual abuse — a first-of-its-kind study exclusively for males."
"the-hindu","Taking a tough stance against Cambridge Analytica’s “cryptic response” to its first notice, the government has again sent notices to both firms."
"the-hindu","Technical aspects of the contract has been agreed, according to Interfax news agency report."
"the-hindu","9:30 amTrump, Macron call for 'new' nuclear deal with IranU.S. President Donald Trump and his French counterpart Emmanuel Macron called for a “new” deal with Iran on Tuesday, looking beyond disagreem"
"the-hindu","The impeachment controversy is now about a presiding officer’s power to reject a motion"
"the-hindu","The ordinance is not enough; the government needs to plug many more legal loopholes"
"the-huffington-post","The decision may pave the way for new applications to the Obama-era program."
"the-huffington-post","The state of Hawaii, which argues that the travel ban is discriminatory and in violation of immigration law, is the lead challenger in the case."
"the-huffington-post","Police are looking for a suspect."
"the-huffington-post","Nakasone replaces Admiral Mike Rogers, who is retiring after nearly four years in the “dual-hat” position leading the NSA and the military’s cyber warfar..."
"the-huffington-post","""We understand this sort of thing happens,"" Australia's foreign minister said."
"the-huffington-post","He plotted to either suffocate her or slit her throat."
"the-huffington-post","""The idea that anyone young or old, past or present, being bullied based on Apu really makes me sad."""
"the-huffington-post","But the GOP had to spend over $1.2 million to keep control of the once-safe seat."
"the-lad-bible","He even has an electronic key in his hand so he can open his front door"
"the-lad-bible","He is playing a stalker, though, so maybe it's a good thing."
"the-lad-bible","After looking at where all the pubs are in the UK, the small English port was found to have the most per square mile"
"the-lad-bible","The next series won't air until 2019, but we now know a few more details"
"the-lad-bible","Strictly Dancer Pasha Kovalev turned the Countdown studio blue - and left his partner Rachel Riley red-faced."
"the-lad-bible","While commuters were furious at the dog owner, other witnesses say the victim was the one who sparked the ordeal"
"the-lad-bible","The rapper has previously spoken openly about his battles with addiction"
"the-lad-bible","Fifty years ago Kathrine Switzer became the first woman to compete in the Boston Marathon; today she is running the London Marathon, aged 71"
"the-lad-bible","Congratulations in order for 'The Rock' on the birth of his third daughter"
"the-lad-bible","The Duchess of Cambridge gave birth this morning"
"the-new-york-times","The case reached the justices 15 months after the first travel ban caused chaos at the nation’s airports and set a new tone on immigration."
"the-new-york-times","The Senate Veterans Affairs Committee is examining multiple claims against President Trump’s nominee to head the Veterans Affairs Department."
"the-new-york-times","Crisscrossing the nation, the embattled attorney general praises the president for supporting law enforcement — most law enforcement, anyway."
"the-new-york-times","The judge rejected the government’s assertion that the Deferred Action for Childhood Arrivals program was unlawful."
"the-new-york-times","The marshals view their jobs as critical to protecting planes and airports from terrorists. But their complaints of alcohol abuse, sexual harassment and racist behavior describe an agency in chaos."
"the-new-york-times","Mick Mulvaney, acting director of the bureau, also described the two types of people he was most responsive to as a lawmaker: constituents and the lobbyists who contributed to his campaign."
"the-new-york-times","President Trump welcomed President Emmanuel Macron of France to the White House on Tuesday for the first state visit since taking office."
"the-new-york-times","There was a mutual kiss on the cheek in the East Room, clasped hands and the first state dinner of the Trump era."
"the-new-york-times","For his exit from the Trump administration, Michael Anton, a self-described “right-wing Francophile,” asked to work as a line cook helping to prepare dinner for the French president."
"the-new-york-times","The former coal mining executive, a strong supporter of President Trump who is running as an “American competitionist,” has refused to disclose his personal finances as required by law."
"the-next-web","When I was a boy of fourteen, my father was so ignorant I could hardly stand to have the old man around. But when I got to be twenty-one, I was astonished at how much he had learned ..."
"the-next-web","At a recent GamesBeat conference, John Hanke, CEO of Niantic (the company best known for introducing Pokemon Go to the world) made waves when he told attendees that he’s “investing ..."
"the-next-web","Hotels are weird. When we check in somewhere, it's typically for a very short time -- often a week or less. Despite that, we often come to look upon our rooms as our homes away from ..."
"the-next-web","Gone are the days when you had to personally break down the concept of Bitcoin to your less informed friends and family. Wikipedia has got them all up to speed now. The 2017 edition of the annual ‘Top 50 Report’ of Wikipedia shows that Bitcoin was the ninth most-read article on the digital encyclopedia for […]"
"the-next-web","Someone has solved MonteCrypto: The Bitcoin Enigma – the viral cryptocurrency puzzle game that promised to reward the first player who solves its 24 “enigmas” with one Bitcoin. Two months after premiering on Steam on February 20, creators Corentin Derbré and Scott Piriou have announced that a “fierce team” of eight players cracked the MonteCrypto mystery […]"
"the-next-web","Oh that dastardly Amazon. First it upends the book industry, then it turns Bezos from a nerd into some sort of killer robot from the future, and now (in the US at least) it wants to ..."
"the-next-web","Over the past few weeks, I've written extensively about the Cambridge Analytica scandal that rocked Facebook, after it was discovered some 87 million users' data was scraped by an analytics ..."
"the-next-web","TNW Conference is offering complimentary tickets to some of the hottest startups in Europe. We’re searching across thirty-two European cities to find the best young companies and ..."
"the-next-web","Binance Labs, the blockchain incubator arm of the world’s largest cryptocurrency exchange Binance, has backed Signal founder Moxie Marlinspike’s proposal for a new cryptocurrency with $30 million in funding. It’s called MobileCoin, and it’s being touted as a cryptocurrency meant to enhance the user experience on mobile devices. The idea is to solve the usability, […]"
"the-next-web","The European Emergency Number Association (EENA) just announced at its conference in Slovenia that it will partner up with Danish AI startup Corti to implement cardiac arrest detecting ..."
"the-sport-bible","The Liverpool legend was very happy with Salah's brace against Roma in the Champions League."
"the-sport-bible","He's admitted it."
"the-sport-bible","The Spurs attacker could avoid military service."
"the-sport-bible","A special goal for Liverpool's incredible player in the Champions League deserved special commentary and boy did it get it."
"the-sport-bible","The Egyptian King looks set to finally break the Messi and Ronaldo dominance..."
"the-sport-bible","One for the future."
"the-sport-bible","Everyone loved it."
"the-sport-bible","Congrats, Mo."
"the-sport-bible","He deserves to be up there."
"the-sport-bible","Zlatan astounds the world...again"
"the-telegraph","Jewish community leaders have accused Jeremy Corbyn of &ldquo;shrugging his shoulders&rdquo; at anti-Semitism as they criticised the Labour leader for failing to show enough leadership on the issue."
"the-telegraph","It&rsquo;s been a busy couple of weeks for the young royals, with a spate of official engagements, the Queen&rsquo;s birthday and the birth of of RB3."
"the-telegraph",NA
"the-telegraph","On Monday evening, we saw Rosie McKeown propel St John's, Cambridge to victory over Merton, Oxford in the final of University Challenge."
"the-telegraph","&ldquo;Do you know how f*****&rsquo; difficult it is to play like that?"
"the-telegraph","Advanced technology is finding a home in the Welsh Valleys, with academia, government and industry collaborating eagerly in a Cardiff technology cluster."
