"doc_id","text"
"abc-news-au","A multi-billion-dollar levy on Australians designed to fund the National Disability Insurance Scheme will be axed, the ABC can reveal."
"abc-news-au","AMP chairman Catherine Brenner must resign or step down immediately, the Australian Shareholders Association is urging."
"abc-news-au","Malcolm Turnbull says it is a shame his really good friend Admiral Harry Harris will not be coming to Canberra to serve as the United States ambassador."
"abc-news-au","Danish inventor Peter Madsen is sentenced to life in prison after being found guilty of murdering Swedish journalist Kim Wall aboard his home-built submarine in August 2017."
"abc-news-au","As more Australians in regional areas connect to the National Broadband Network, congestion is creating havoc during busy times."
"abc-news-au","The latest incident of Australian stock suffering during live exports has led some farmers and even government MPs to question whether the trade should be banned."
"abc-news-au","Australia's newest museum — a tribute to the men and women of WWI — is opened in France by Prime Minister Malcolm Turnbull."
"abc-news-au","One hundred and three years on, Australia and New Zealand remember the dawn landings at Gallipoli with a memorial service at Anzac Cove."
"abc-news-au","Port Moresby's governor Powes Parkop is being investigated by anti-corruption police, after a former official revealed the city council was paying $1.2 million a year to a company run by his alleged partner."
"abc-news-au","Dozens of Central American migrants traveling in a caravan through Mexico arrive at the border city of Tijuana, despite warnings from President Donald Trump they would be turned away and it would be futile to try to cross to claim asylum in the United States."
"al-jazeera-english","US president says wealthy Middle East countries must foot the bill for US presence in Syria and deploy their own troops."
"al-jazeera-english","Police in Jodhpur city are on high alert because of anticipated violence from the religious leader's followers."
"al-jazeera-english","Copenhagen court finds Peter Madsen guilty on premeditated murder, sexual assault and desecrating a corpse."
"al-jazeera-english","Brace against former club Roma in the Champions League semi-final takes the Egyptian's tally to 43 in all competition."
"al-jazeera-english","Activists describe scenes of besieged camp in southern Damascus as Syrian government forces attempt to drive out ISIL."
"al-jazeera-english","Analysts say rival factions are struggling to find consensus candidate to secure stability in post-Bouteflika Algeria."
"al-jazeera-english","The Russian government has just scored an own goal trying to block popular messenger app Telegram."
"al-jazeera-english","Thousands of Yemeni-American families have been stranded in Djibouti or forced back to Yemen due to Trump's travel ban."
"al-jazeera-english","Journalist Fatma Naib explored the painful practice of female genital mutilation that affects about 200 million women."
"ars-technica","Bright dots that look like snow are in fact stars."
"ars-technica","A stable cryptocurrency would be groundbreaking—could this one work?"
"ars-technica","New updates for iPhones, iPads, and Macs address bugs and vulnerabilities."
"ars-technica","Games will probably have to support it to see the full benefits."
"ars-technica","A key part of the 2011 America Invents Act is constitutional, high court rules."
"ars-technica","Almost 1,300 addresses for Amazon Route 53 rerouted for two hours."
"ars-technica","Plus deals on Dell monitors and PCs, Samsung SSDs, iPads, and more."
"ars-technica","Social network not saying why it took 14 years to release this document."
"ars-technica","Latest Insider build has a strange new SKU."
"ars-technica","Frozen survival and city-building mix well in this proto-steampunk pastiche."
"associated-press","PHILADELPHIA (AP) — Philadelphia-born rapper Meek Mill rang a replica Liberty Bell at center court of the Philadelphia 76ers' first-round clinching playoff game Tuesday less than two hours after being released from prison while he appeals decade-old gun and drug convictions. Following a five-month campaign by his supporters to get him out, the state Supreme Court on Tuesday directed a Philadelphia judge who had jailed him to immediately issue an order releasing him on unsecured bail. Mill, whose real name is Robert Rihmeek Williams, was sentenced in November to two to four years behind bars for probation violations."
"associated-press","WASHINGTON (AP) — The Supreme Court is saving one of its biggest cases for last. The justices are hearing arguments Wednesday over President Donald Trump's ban on travelers from several mostly Muslim countries. It's the last case the justices will hear until October. The Trump administration is asking the court to reverse lower court rulings striking down the ban. The policy has been fully in effect since December, but this is the first time the justices are considering whether it violates immigration law or the Constitution."
"associated-press","SAN DIEGO (AP) — A federal judge ruled that the Trump administration must resume a program that has shielded hundreds of thousands of young immigrants from deportation but gave it 90 days to restate its arguments before his order takes effect. The ruling by U.S. District Judge John D. Bates in Washington, if it survives the 90-day reprieve, would be a new setback for the administration because it would require the administration to accept requests from first-time applicants for the Deferred Action for Childhood Arrivals program. Two nationwide injunctions earlier this year applied only to renewal requests."
"associated-press","Your daily look at late-breaking news, upcoming events and the stories that will be talked about today: 1. SUPREME COURT SAVING ONE OF BIGGEST CASES FOR LAST Justices will hear arguments over Trump's ban on travelers from several mostly Muslim countries. 2. WHY SENATORS ARE GROWING FRUSTRATED Lawmakers from both parties feel that the White House is skipping crucial vetting of nominees and leaving lawmakers to clean up the mess."
"associated-press","COPENHAGEN, Denmark (AP) — Danish submarine inventor Peter Madsen was found guilty Wednesday of torturing and murdering Swedish reporter Kim Wall before dismembering her body during a private submarine trip. He was sentenced to life in prison. Copenhagen City Court Judge Anette Burkoe said she and two jurors unanimously decided Wall's death was a murder, finding Madsen also guilty of sexual assault and the defilement of a corpse. ""It is the court's assessment that the defendant killed Kim Wall,"" Burkoe told the packed courtroom."
"associated-press","INDIANAPOLIS (AP) — The Commission on College Basketball sharply directed the NCAA to take control of the sport, calling for sweeping reforms to separate pro and college tracks, permit players to return to school after going undrafted by the NBA and ban cheating coaches for life. The independent commission, led by former Secretary of State Condoleezza Rice, released a detailed 60-page report Wednesday, seven months after the group was formed by the NCAA in response to a federal corruption investigation that rocked college basketball. Ten people, including some assistant coaches, have been charged in a bribery and kickback scheme, and high-profile programs such as Arizona, Louisville and Kansas have been tied to possible NCAA violations."
"associated-press","WASHINGTON (AP) — As President Donald Trump's pick to lead Veterans Affairs skids to a halt, senators from both parties are voicing frustration that the White House is skipping crucial vetting of nominees and leaving lawmakers to clean up the mess. That sentiment was evident Tuesday on Capitol Hill after senators delayed hearings for White House physician Ronny Jackson, Trump's surprise pick to head the VA. Jackson is facing questions about improper workplace behavior, and even Trump himself acknowledged that there were concerns about his nominee's experience."
"associated-press","TORONTO (AP) — A chilling Facebook message posted before a van plowed onto a crowded Toronto sidewalk has raised the possibility the suspect in the attack nursed grudges against women and it is bringing back memories of a 1989 massacre of 14 women that remains one of Canada's most traumatic acts of violence. A crowd gathered late Tuesday in Toronto's North York community to pay their respects to the van victims at a makeshift memorial of roses, candles and messages of condolence. ""I needed to come here to show that I'm not afraid of this city,"" said Meena Chowdry, wiping away tears. ""That one man's actions cannot taint an otherwise beautiful, welcoming city."""
"associated-press","GLENDALE, Ariz. (AP) — It took a big money push from the Republican Party, tweets by the president and the support of the state's current and former governors, but the GOP held onto an Arizona U.S. House seat they would have never considered endangered in any other year. Tuesday's narrow victory by Republican Debbie Lesko over a Democratic political newcomer sends a big message to Republicans nationwide: Even the reddest of districts in a red state can be in play this year. Early returns show Lesko winning by about 5 percentage points in Arizona's 8th Congressional District where Donald Trump won by 21 percentage points."
"associated-press","LAIZA, Myanmar (AP) — On the front lines, the army is pounding rebels with airstrikes and artillery. In the displacement camps, terrified civilians are building bomb shelters of sandbags and stones. And everywhere in this troubled swath of Myanmar's north, there is a growing sense the conflict will only get worse. While the world is focused on the plight of Myanmar's Rohingya Muslims, a civil war is raging here, pitting government forces against another of the country's minorities — the Kachins, mostly Christian. It's one of the longest-running wars on Earth, and it has intensified dramatically in recent months, with at least 10,000 people displaced since January alone, according to the United Nations."
"bbc-news","President Rouhani speaks out after the US and France announce plans to broaden the deal's terms."
"bbc-news","Danish inventor Peter Madsen is found guilty of murdering the journalist Kim Wall on his submarine."
"bbc-news","First accused of faking a master's degree, now Cristina Cifuentes has been hit by shoplifting claims."
"bbc-news","Punjilal Meher allegedly plotted the killing after the victim's mother was promoted over him at work."
"bbc-news","The first lady throws her first state dinner under the Trump administration by hosting the French president and his wife."
"bbc-news","The actor told Stephen Colbert it felt ""the right thing do"" amid racial stereotyping claims."
"bbc-news","A tight contest in a district that Donald Trump won by a wide margin worries GOP ahead of mid-terms."
"bbc-news","US actress Rose McGowan tells the Victoria Derbyshire show Harvey Weinstein has tried to contact her."
"bbc-news","It leapt to the defence of Dr Ronny Jackson hours after suggesting he should step aside."
"bbc-news","After a man walked in carrying a gun, it fell to one cowboy-hat wearing man to stop him."
"bbc-sport","Arsenal manager Arsene Wenger says that the timing of his departure from the club after nearly 22 years ""was not really my decision""."
"bbc-sport","The World Snooker Championship continues at the Crucible in Sheffield - watch BBC Sport coverage."
"bbc-sport","Liverpool played so well in their win over Roma that MOTD pundit and former Liverpool defender Mark Lawrenson could not comprehend it."
"bbc-sport","A ""tsunami"" of match-fixing is plaguing lower-level tennis events, says a long-awaited report into corruption in the sport."
"bbc-sport","George North is to play for Ospreys when he leaves Northampton at the end of this season."
"bbc-sport","With just 50 days to go until the 2018 World Cup, watch James Rodriguez's stunning goal for Colombia against Uruguay in 2014."
"bbc-sport","Merseyside Police say it happened shortly before Liverpool's semi-final with Roma."
"bbc-sport","Former world number one Novak Djokovic is beaten by Slovakian qualifier Martin Klizan in the second round of the Barcelona Open."
"bbc-sport","Mark Williams completes a 10-5 win over Jimmy Robertson as the two-time champion reaches round two of the World Championship."
"bbc-sport","Tony Bellew says he will stop David Haye inside eight rounds in their rematch and insists his rival ""should have stayed clear"" of him."
"bloomberg","A huge swath of the corporate bond market is looking increasingly vulnerable."
"bloomberg","Comcast Corp. kicked off a bidding war for Sky Plc by formalizing its 21.5 billion pound ($30 billion) offer for Britain’s largest pay-TV company, throwing down the gauntlet to Rupert Murdoch’s 21st Century Fox Inc. and Walt Disney Co."
"bloomberg","Twitter Inc.’s push into live video and more personalized content is finally starting to pay off, boosting revenue and profit more than projected in the first quarter by luring users and advertisers. The shares surged."
"bloomberg","Facebook Inc. is on tap to report first-quarter results after the close of trading on Wednesday, and Wall Street will scour the numbers for any signs of user losses or a drop-off in advertiser spending."
"bloomberg","PetSmart’s owners thought embracing e-commerce would keep it competitive in the age of Amazon."
"bloomberg","A lot of Democrats think the billionaire investor is the wrong man with the wrong idea. Ask him if he cares."
"bloomberg","The U.S. housing market’s storyline for the last several years has been one of steady demand and limited supply, pushing prices ever higher. Now, a new chapter has opened up for the industry and its customers: soaring costs for building materials."
"bloomberg","WeWork Cos. is tapping the bond market for the first time and in doing so, has provided a rare glimpse into the startling numbers behind its breakneck expansion."
"bloomberg","Lockheed Martin Corp.’s new $31 billion helicopter for the Marine Corps may be falling behind schedule and could miss its target for initial combat capability by as much as eight months, Pentagon analysts say."
"bloomberg","Fiat-Chrysler has overhauled its moneymaker and steered it upmarket."
"breitbart-news","Abuses of power by Google have the potential to dramatically impact democratic elections, and are nearly impossible to detect."
"breitbart-news","Sen. Ted Cruz (R-TX) recommended usingantitrust laws to curb the ""massive power"" of Facebook and other technology companies during a Tuesday interview with SiriusXM hosts Rebecca Mansour and Joel Pollak on Breitbart News Tonight."
"breitbart-news","United States President Donald Trump and First Lady Melania Trump welcomed French President Emmanuel Macron and French First Lady Brigitte Macron with a grand military demonstration on the White House south lawn that featured the firing of cannons and playing of each country’s national anthem."
"breitbart-news","First Lady Melania Trump is the belle of the ball at the United States-France state dinner, which she planned on her own, in a custom-fitted Chanel Haute Couture gown."
"breitbart-news","The stars of President Trump's administration and some of his famous friends arrived at the United States-France state dinner thrown by First Lady Melania Trump, who coordinated the event."
"breitbart-news","The Associated Press declared Republican Debbie Lesko the winner of Tuesday's special election in Arizona's 8th Congressional District over Democrat Hiral Tipirneni at 11:08 p.m. Eastern, one hour and eight minutes after the polls closed."
"breitbart-news","The NRA broke a 15-year fundraising record by taking in nearly $2.5 million for its Political Victory Fund in the month of March alone."
"breitbart-news","Sen. Ted Cruz (R-TX) said he expected to support President Donald Trump's tentative reelection campaign in 2020 during a Tuesday interview with SiriusXM hosts Rebecca Mansour and Joel Pollak on Breitbart News Tonight."
"breitbart-news","Trump holds Murdoch in high esteem, frequently calling him for advice despite his criticism of the president on issues like illegal immigration."
"breitbart-news","Several reports indicate that the fragments of the ""migrant caravan"" are now arriving south of the U.S. border with Mexico. Border Patrol officials in California and Arizona said they have not seen any illegal border crossings between ports of entry this week."
"business-insider","21st Century Fox, which owns 40% of Sky, has been trying to buy the remaining stake since the end of 2016 but has faced repeated regulatory hurdles."
"business-insider","Google confirmed the visual and functionality changes rumored to be coming to Gmail accounts — the first major redesign to the web interface in years."
"business-insider","BI PRIME: Rick Rieder, the chief investment officer of fixed income at BlackRock, says millennial technological adoption is changing the economy as we know it."
"business-insider","10 things you need to know before the opening bell (SPY, SPX, QQQ, DIA, SNAP, CAT, AMZN, JPM, BRK.A)"
"business-insider","BI PRIME: Societe Generale's Albert Edwards believes that a global market crash could be very close, thanks to a major development this week."
"business-insider","Wyze Labs' first product is a $20 camera that the company says can easily stand up to Google's $199 Nest camera."
"business-insider","Ronny Jackson had allegedly caused such a scene that the Secret Service intervened out of concern that he might wake up then-President Barack Obama."
"business-insider","Twitter shares rose after it reported its Q1 earnings."
"business-insider","BI PRIME: Giant ad-buying agencies are exploring direct programmatic-ad deals with top publishers."
"business-insider","Gemini will use Nasdaq's SMARTS, a surveillance technology used across Wall Street."
"business-insider-uk","Exclusive research commissioned by Business..."
"business-insider-uk","Major cryptocurrencies down between 5% and 10%..."
"business-insider-uk","The UK government's business department lacks the planning, staff and IT systems to deliver Brexit-related policies, a damning report put together by MPs warns."
"business-insider-uk","Peter Madsen invited Kim Wall onboard his submarine in Copenhagen in August last year and was the last person to see her alive."
"business-insider-uk","Apple will start making payments this quarter, with all of the funds in the escrow account by the end of the third quarter. Interest will be calculated after th"
"business-insider-uk","World heavyweight boxing champion Anthony Joshua says stretching is a workout in itself."
"business-insider-uk","Vladimir Uglev has reportedly been hit by a car..."
"business-insider-uk","Robey Warshaw brought in £72.7 million in revenue in the year ended March 31, 2017, after scoring roles on a series of huge takeover deals."
"business-insider-uk","Here's why you can expect a good earnings report from Facebook on Wednesday, according to the company's second biggest bull on Wall Street."
"business-insider-uk","These amazing sculptures are created by Noah Deledda. He sculpts each one using his thumbnails to achieve a precise pattern."
"buzzfeed","The Toronto van attack suspect posted a ""cryptic"" Facebook message that supported violence against women, officials said."
"buzzfeed","Police are now on high alert for riots by followers of Asumal Sirumalani, known to his supporters as Asaram Bapu."
"buzzfeed","What does this mean?"
"buzzfeed","An op-ed in the journal Science has sparked a debate about how women in science use social media."
"buzzfeed","""My eyes have been opened,” said Hank Azaria, following the release of the documentary 'The Problem with Apu.'"
"buzzfeed","""TURN OFF YOUR PHONE! YOUR PHONE IS ON!"""
"buzzfeed","Are you more of a sausage roll or a Scotch egg?"
"buzzfeed","The false story comes from a well-known fake news publisher."
"buzzfeed","""Way Day"" = their lowest prices of the year (plus free shipping on EV-ER-Y-THING), so if you've been thinking of redecorating...now is the time, my deal-seeking friends! Now is the time."
"buzzfeed","Wall, who had been working on a story about inventor Peter Madsen, was killed in August last year."
"cnbc","Several companies, from chipmaker Nvidia to toymaker Hasbro, are reporting the impact of a shortage of truck drivers on their businesses."
"cnbc","Boeing is expected to report its first quarter earnings before market open Wednesday."
"cnbc","Tim Cook and Donald Trump's meeting is scheduled for 1.45 p.m. Washington time, but no agenda has been released."
"cnbc","Republican Debbie Lesko is projected to win Tuesday's Arizona House special election over Democrat Hiral Tipirneni."
"cnbc","Google didn't just refresh the design of its Gmail desktop app. It added many capabilities, including a sidebar with Google Calendar and a confidential mode."
"cnbc","UBS raises its rating to buy from neutral for Verizon Communications shares, citing its low valuation versus the market."
"cnbc","Once the space matures, Nasdaq would consider becoming a digital currency exchange, according to the company's CEO."
"cnbc","China's GDP growth will slow if a trade war with the U.S. ensues. That, along with the Red Giant's debt bubble, puts its future at risk."
"cnbc","Amazon is launching a new Amazon Echo for kids that delivers kid-friendly audiobooks and answers from its Alexa voice assistant. It also gives parents more control over what their kids can use the Echo for."
"cnbc","Shares opened at $31.35 after trading as high as $34 in extended hours."
"cnn","During an overseas trip in 2015, Rear Adm. Ronny Jackson, the White House physician, was intoxicated and banged on the hotel room door of a female employee, according to four sources familiar with the allegation."
"cnn","The embattled nominee tapped to lead the Department of Veterans Affairs was known as ""the candy man"" inside the White House, Sen. Jon Tester said Tuesday, citing reports from individuals who raised concerns about his nomination."
"cnn","CNN's Anderson Cooper says Trump's campaign promise to ""get the best people"" for his administration is not panning out well."
"cnn","With the botched Jackson pick, Donald Trump has managed to be simultaneously reckless, thoughtless and disloyal, by publicly undermining his friend at the first hint of trouble, writes Ryan Lizza."
"cnn","During his joint news conference with French President Emmanuel Macron on Tuesday, President Donald Trump wanted to make two things very clear in regard to his embattled Veteran Affairs nominee, Ronny Jackson:"
"cnn","Danish inventor Peter Madsen has been found guilty of the mutilation and murder of Swedish journalist Kim Wall, and sentenced to life in prison."
"cnn","Hank Azaria says his ""eyes have been opened"" and he's willing to ""step aside"" from playing his controversial ""Simpsons"" character."
"cnn","Meek Mill will soon leave prison."
"cnn","Toronto police are still trying to piece together the motive behind the van attack that left 10 people dead and whether the suspect's frustrations with women contributed to the rampage."
"cnn","Some students and school officials were outraged after a Florida high school student's prom proposal sign referenced ""picking cotton."""
"daily-mail","The Brexit Secretary said Brussels was engaging in negotiating tactics by rubbishing the ideas Britain had put forward for a so-called 'customs partnership' or streamlined arrangement."
"daily-mail","Meghan, 36, looked suitably sombre in a cream coat, black hat and heels, with her hair loose at the event to remember Australian and New Zealand soldiers who died at Gallipoli in 1915."
"daily-mail","Tom Evans and Kate James's lawyers will go to the Court of Appeal in London at 2pm to overturn a High Court ruling stopping them flying him to the Pope's children's hospital in Rome."
"daily-mail","Luciana Berger joined the march to support her colleague Ruth Smeeth who is giving evidence against Marc Wadsworth - an activist accused of anti-Semitism."
"daily-mail","Robert Peters, 56, throttled Sophia with a dressing gown cord while alone with her at his £1 million family home in Wimbledon, south west London, last November."
"daily-mail","Stuart Barber, 50, angrily posted the demand on the offending Dodge Caliber's windscreen after it parked outside his home in Rhodes Avenue, Bishop's Stortford."
"daily-mail","A petition on Change.org asking the Queen to intervene and help save brain-damaged Alfie Evans has gathered more than 166,000 signatures in just over two days."
"daily-mail","Giving evidence to MPs, Sam Gyimah said ensuring its survival was a matter of social justice because of the support it provides for disadvantaged students."
"daily-mail","Mr Justice Hayden slammed Pavel Stroilov, pictured, who works for the Christian Legal Centre (CLC) and believes Alfie's doctors should be prosecuted for murder."
"daily-mail","Staff at Ernie's News in North Ormesby, Middlesbrough, hurled the spices at Paul Christian Callaghan, 45, and fended him off with a ladder, stick and advertising sign during the raid."
"engadget","Say hello to the new Gmail."
"engadget","Philips lays claim to the first HDR 1000 Monitor."
"engadget","Amazon is so confident in 'Tom Clancy's Jack Ryan' that it's renewing the show before the first season has even premiered."
"engadget","OnePlus is announcing the 6 at a London event on May 16th, although you might already know what's coming."
"engadget","Dell's latest 2-in-1 hints at a ""pro"" version of Intel and AMD's Radeon RX Vega M GL graphics."
"entertainment-weekly",""
"entertainment-weekly","Take a look at the star-studded annual event"
"entertainment-weekly",""
"entertainment-weekly",""
"entertainment-weekly",""
"entertainment-weekly",""
"entertainment-weekly",""
