"doc_id","text"
"entertainment-weekly",""
"entertainment-weekly",""
"entertainment-weekly",""
"espn","The Commission on College Basketball directed the NCAA to minimize one-and-done, permit players to return to school after going undrafted and ban cheating coaches for life"
"espn","With Gregg Popovich expected to take the lead, the Spurs plan to meet with Kawhi Leonard over the summer to gauge whether the sides can work out their differences, sources told ESPN."
"espn","Heat star Dwyane Wade acknowledged he has considered the possibility of retiring but said he wasn't ready to make a final decision until later in the offseason."
"espn","Ronald Acuna, who is ranked No. 1 on ESPN Insider Keith Law's top 100 prospects in baseball, is set to join the Braves on Wednesday in Cincinnati."
"espn","Wide receiver prospect Antonio Callaway tested positive for marijuana at the combine, NFL sources said. Callaway's agent said it was for a diluted sample."
"espn","Rapper Meek Mill, who had widespread support from the sports world, has been released from prison and is attendance for the Sixers' game vs. the Heat."
"espn","With free agency out of vogue, betting early on young players can pay big dividends."
"espn-cric-info","England and South Africa will kick off the tournament at The Oval on May 30, and Lord's will host its fifth World Cup final on July 14"
"espn-cric-info","Get a preview of the Royal Challengers Bangalore vs Chennai Super Kings Indian Premier League 2018 cricket match."
"espn-cric-info","The new captain Iyer, who comes in with coach Ponting's full support, said ""we still have the potential to win the tournament."""
"espn-cric-info","The coach, as cricket knew the role, might be outdated. How will back rooms be run in the future?"
"espn-cric-info","Having gone for 104 in his previous eight overs, the legspinner worked out exactly where he had gone wrong, and set things right spectacularly in a match-winning spell against Mumbai Indians"
"espn-cric-info","Also, Siddarth Kaul effectively used distinct plans for different batsman. Did his performance improve his stock as an end-overs bowler?"
"espn-cric-info","The Mumbai Indians head coach said he can't get too emotional about the team's performance, and wanted time to reflect on it before deciding on a future course of action"
"espn-cric-info","Get a report of the Mumbai Indians vs Sunrisers Hyderabad Indian Premier League 2018 cricket match."
"espn-cric-info","Alastair Cook has admitted England were curious about how Australia got the ball to reverse-swing on the final day of the Perth Test after heavy rain"
"espn-cric-info","Somerset fast bowler could miss a month with a muscle tear, while Leicestershire's Zak Chappell has been subject to an approach from Warwickshire"
"financial-times","Shares of Japanese pharmaceutical group drop 9% in response"
"financial-times","Mark Read has a lot on his plate as ad group reels from exit of Martin Sorrell"
"financial-times",NA
"financial-times","Social media company had been expected to return to a net loss"
"financial-times","Beijing withholds key approval of transaction as Trump pumps up rhetoric"
"financial-times","Ten-year Treasury back over 3% while US earnings worries hit sentiment"
"financial-times",NA
"financial-times","Wednesday’s results may reveal the impact of privacy scandal and news feed overhaul"
"financial-times","French president seeks to bolster relationship in carefully choreographed state visit"
"financial-times","Japanese tech investor owns stakes in Uber, Ola, Grab, 99 and Didi Chuxing"
"football-italia","Milan sporting director Massimiliano Mirabelli says &ldquo;I knew at the start I had a lot of enemies&rdquo; amid rumours he&rsquo;ll be sacked."
"football-italia","Genoa goalkeeper Mattia Perin admits &ldquo;I might leave&rdquo; because &ldquo;I want to test myself in the Champions League&rdquo;."
"football-italia","Juventus fans turned up at the training centre in Vinovo, letting off flares and singing songs, but insist they&rsquo;re only trying to &ldquo;encourage the team&rdquo;."
"football-italia","On this day in 1984, Roma completed a European comeback by beating Dundee United 3-0 at the Stadio Olimpico."
"football-italia","Mauro Icardi admits &lsquo;I don&rsquo;t know what the future holds&rsquo; but insists Inter &lsquo;have always been my team&rsquo;."
"football-italia","Torino President Urbano Cairo reveals he wanted to appoint Gian Piero Gasperini in 2015 but Giampiero Ventura &ldquo;decided to continue&rdquo;."
"football-italia","The English media reacts to Liverpool&rsquo;s 5-2 win over Roma, with most believing that the Reds will reach the Champions League final in Kiev."
"football-italia","Monchi insists Roma &lsquo;can repeat what we did against Barcelona&rsquo; and stun Liverpool to reach the Champions League Final."
"football-italia","Ex-England defender Rio Ferdinand claims Eusebio Di Francesco &lsquo;let Roma down&rsquo; and questioned whether the Coach had even watched Liverpool play."
"football-italia","Sweden boss Janne Andersson has confirmed that Zlatan Ibrahimovic &lsquo;certainly isn&rsquo;t included in my plans for the World Cup&rsquo;."
"fortune",""
"fortune",""
"fortune",""
"fortune",""
"fortune",""
"fortune",""
"fortune",""
"fortune",""
"fortune",""
"four-four-two","Arsenal face Atletico Madrid in the Europa League semi-final, and departing Arsene Wenger has told his players to claim what they deserve."
"four-four-two","Patrick Vieira feels ready for ""any"" job in Europe after Arsene Wenger announced he will leave Arsenal, though he is no rush to leave MLS."
"four-four-two","Departing Arsenal manager Arsene Wenger is not looking to retire just yet, but he will not allow a future job to cloud his current focus."
"four-four-two","Jose Mourinho has helped Scott McTominay to settle in the Manchester United first team, the midfielder says."
"four-four-two","Francisco Javier Garcia Pimienta has been tasked with steering Barcelona B clear of relegation in LaLiga2 following Gerard Lopez's sacking."
"four-four-two","Bayern Munich have been linked with a move for Gareth Bale in a potential transfer that the Real Madrid man refused to rule out."
"four-four-two","A Liverpool fan is in a critical condition after being attacked by Roma fans on Tuesday, and the Italian club feel shamed by the incident."
"four-four-two","A Liverpool fan is in a critical condition after being attacked by Roma supporters on Tuesday, and UEFA has slammed the incident as ""vile""."
"four-four-two","Sol Campbell thinks Arsene Wenger's replacement should have a connection to Arsenal, tipping Patrick Vieira and Dennis Bergkamp to link up."
"four-four-two","Marc Wilmots' recent claims about the leaking of Belgium team news at Euro 2016 has angered Thibaut Courtois, who is taking legal action."
"fox-sports","The full version of 'Where Angels Fear to Tread' by Kirill Richter: A 23-piece orchestra, featuring strings, trumpets, cornets and a piano, recorded the riveting showpiece in Moscow for what is expected to be the summer’s most-anticipated sporting event."
"fox-sports","Find live Soccer scores, Soccer player; team news, Soccer videos, rumors, stats, standings, team schedules; fantasy games on FOX Sports."
"fox-sports",NA
"fox-sports","Argentina striker Paulo Dybala comes in at #50 in Stu Holden’s top players to watch this summer in Russia"
"fox-sports",NA
"fox-sports","Landon Donovan sends the USMNT into the Round of 16 at the death, scoring very late in their final group stage match against Algeria and setting off massive celebrations in bars and watch parties around the US. Credited with pushing World Cup fever to new heights in the US. A group stage exit would have been devastating."
"fox-sports",NA
"fox-sports","Reflecting on Philadelphia closing out the Miami Heat in round one of the 2018 NBA Eastern Conference Playoffs with their 104-91 victory last night, Nick Wright reveals to Cris Carter and Jenna Wolfe how the Sixers have been able to triumph in the postseason despite their lack of collective experience."
"fox-sports","Cris Carter and Nick Wright team up on First Things First, a discussion and opinion-based studio program that covers all the headlines weekdays on FS1."
"fox-sports",NA
"google-news","The president made it a point to highlight the first lady's efforts during his opening toast."
"google-news","Justices on Wednesday review whether ban was to protect, or to fulfill anti-Muslim campaign promise"
"google-news","Welcome to The Hill's Morning Report, and happy Wednesday!"
"google-news","Comcast has formally submitted a $31 billion bid to buy Sky, prompting the European pay-TV operator to drop its backing for a takeover by Fox and setting up a bidding war for the company."
"google-news","Democrats have outperformed expectations in six of six special congressional elections in the Trump era."
"google-news","The submarine creator had admitted to dismembering the Swedish journalist and to discarding her body. He was sentenced to life in prison, the maximum possible."
"google-news","Gmail’s biggest redesign is now live with the addition of many new features, including confidential mode, high-priority notifications on mobile, and a brand new Google Tasks app."
"google-news","The government must restore a scheme to let young undocumented immigrants stay, a judge says."
"google-news","The former Port Authority official intervened in the March 31 traffic stop as ""a concerned citizen and a friend of the mayor."""
"google-news","Police are now on high alert for riots by followers of Asumal Sirumalani, known to his supporters as Asaram Bapu."
"hacker-news",NA
"hacker-news",NA
"hacker-news",NA
"hacker-news","Microsoft announces the Microsoft Professional Program in AI, the latest learning track teaching artificial intelligence skills open to the public."
"hacker-news",NA
"hacker-news","Electric buses were seen as a joke at an industry conference in Belgium seven years ago when the Chinese manufacturer BYD Co. showed an early model."
"hacker-news","Over the few last hours, a dozen news stories have broken about how an attacker attempted (and perhaps managed) to steal cryptocurrencies using a BGP leak."
"hacker-news","Google launches Chat - new messaging service for Android phones"
"hacker-news","Between 11am until 1pm UTC today, DNS traffic — the phone book of the internet, routing you to your favourite websites — was hijacked by…"
"hacker-news","“This is what a view on a comet looks like, among dust, stars and cosmic ray hits, as captured by @ESA_Rosetta on June 1, 2016 and processed by @landru79 from these raw data: https://t.co/h3BV6Z2V71 https://t.co/w1Yv4OwIo1”"
"ign","Marvel Studios' Kevin Feige talks about the potential of using the comics for future stories in the MCU."
"ign","The first glimpse of Aquaman was at LA's CinemaCon and showed parts of Atlantis."
"ign","We have a breakdown of every comic included in this year's Free Comic Book Day promotion."
"ign","Apu voice actor says his &quot;eyes have been opened&quot; following Simpsons' controversy."
"ign","Who's going to win Marvel's Infinity War? We settled things with a WWE 2K18 Royal Rumble."
"ign","Captain America (aka Finchy) tries to clear the Undead Burg using only his shield. What a guy."
"ign","Jason Momoa is a fan of the LEGO Batman movie if his recent CinemaCon comments are anything to go by."
"ign","Alfheim - God of War (2018): The Realm of Alfheim is one of the main Regions in God of War. It is the first main realm other than Midgard that you can explore in the game, and pa..."
"ign","BattleTech provides exciting strategic decisions and a compelling story, even if they are held back a bit by frustratingly unpredictable weapons."
"ign","Let us know what you thought of tonight's new episode, as Citizen Cold paid a visit to Central City."
"independent","Demand for a second Brexit referendum on the final deal negotiated by Theresa May is “growing” as the damaging impact of leaving the European Union becomes clearer, Labour’s leader in Brussels has said."
"independent","The case of Alfie Evans is desperately sad. Here is a 23-month-old child who had every appearance of being a healthy baby boy before a progressive neurodegenerative disorder left him in a semi-vegetative state. Alfie has been reliant on mechanical ventilation since December 2016. I have been following the case closely, and in many ways, it is too close for comfort."
"independent","Snow could return to the UK as temperatures continue to slump following a record-breaking warm spell last week.  Met Office forecasters are warning Britons to expect showers through the week and into the weekend with temperatures in the south plummeting as low as 6C on Monday."
"independent","An Israeli soldier has been filmed celebrating after shooting a Palestinian protester with rubber bullets. The video, released by Jerusalem-based Israeli rights group B’Tselem, shows three soldiers discussing the best way to shoot at the protesters. In the video the soldiers say the protesters are throwing rocks. One of the soldiers then fires, before laughing and saying “the son of a bitch”."
"independent","The Simpsons' Hank Azaria has addressed in full the current discussion on Apu and his controversial depiction on the show."
"independent","Amber Rudd is likely to face tough questions from MPs over the Windrush fiasco when she appears in front of the Home Affairs Select Committee this afternoon. The Home Secretary is one of four senior cabinet ministers set to receive a grilling in Parliament on what is bound to be an action-packed day in Westminster."
"independent","The daughter of a woman who arrived in the UK with the Windrush generation is facing imminent removal despite all of her family, including her dying mother, being based in Britain."
"independent","Truly independent journalism designed for a premium digital experience. Detailed coverage of national and global headlines and incisive articles from our award-winning team of journalists. Exclusive supplements covering topics that benefit from in-depth analysis and reporting."
"independent","Awkward footage has emerged of Melania Trump appearing to somberly rebuff Donald Trump’s attempt to hold her hand outside the White House. Standing next to French President Emmanuel Macron and his wife Brigitte, the US president could be seen poking his left forefinger at the back of the first lady’s hand as his wife remained unresponsive."
"independent","Alek Minassian, the Toronto van attack suspect, is believed to have posted on Facebook praising “incel” killer Elliot Rodger only minutes before 10 people were mown down and killed in the Canadian city on Monday. Referencing the misogynistic “involuntary celibacy” online community, the post called Rodger “the supreme gentleman” and continued: “The incel rebellion has already begun!”"
"mashable","Why couldn't all 18 year olds be this clever? Namely, me?"
"mashable","What are you waiting for?"
"mashable","The change comes into effect in May."
"mashable","I miss the old Kanye."
"mashable","""Me trying to explain to the lads that I've never watched Breaking Bad."""
"mashable","Drunk shopping is the best shopping."
"mashable","Glue? Check. Glitter? Check. A badminton racket? Check."
"mashable","Machine learning is a subset of AI that makes computers act and learn like humans do."
"mashable","Your Mac is your number one productivity tool. Help it get even better."
"metro","This robber will rue the day he walked into this shop."
"metro","He's reportedly coming on July 13, so clear your diaries."
"metro","The wait continues for the full name of the UK's newest prince."
"metro","David Kirk and Jack Smith are accused of attacking the girl as she lay face down on a bed after blacking out drunk at a party"
"metro","A mother says she witnessed a customer making the racist comment to a Muslim shop assistant before being given 'express service' by a white manager."
"metro","Last week's sprinkling of hot weather was a taste of things to come."
"metro","He was hit by the vehicle when he was crossing a street near his home."
"metro","Claudia Rodrigues, 26, pretended to be a man and befriended Zeila Cotterill on Facebook."
"metro","The youngster was taken off life support on Monday but has survived two nights since then."
"metro","He once attempted to clear things up by saying he 'never sent death threats' but 'took the view homosexuals should face the death penalty'."
"mirror","Prince William joined his brother Harry and fiancee Meghan Markle at Westminster Abbey to mark Anzac Day"
"mirror","High Court judge Mr Justice Hayden yesterday ruled out plans to take the little boy to Rome - but parents Tom and Kate are appealing the decision today"
"mirror","There is a very well known actor hiding underneath a fat suit for his latest role as a controversial politician"
"mirror","They won't stop to ask what Jesus would do while campaigning against the sort of embryonic research that may one day cure babies with the same condition"
"mirror","Meshel Laurie pointed out that Kate's quick style turnaround wasn't all ""inspiring"" - it was hard on new mum"
"mirror","A viral video showed the moment Ronnie Pickering, 57, was knocked to the ground by a vicious thug in Hull - but he refuses to report it to police or seek medical treatment for 'cracked ribs' and bruising"
"mirror","Stephen Unwin and William McFall - who had both served time in prison for previous murders - ate a curry and messaged loved ones as 28-year-old Quyen Ngoc Nguyen lay dying"
"mirror","Paul and Kayleigh Livermore say they are struggling to provide for their three young children after three accounts were frozen by Barclays, each of them £500,000 in the red"
"mirror","Kate delivered her youngest son, weighing 8lbs, 7oz, at 11.01am on St George's Day just seven hours before introducing him to the world on the steps of the exclusive Lindo Wing, St Mary's Hospital"
"mirror","Police believe he was knocked to the ground with a belt during violent clashes that marred the game, which Liverpool won 5-2"
"mtv-news","Dreams do come true"
"mtv-news","A stormy, one-take depiction of anxiety"
"mtv-news","What a smile"
"mtv-news","The Love Guru"
"mtv-news","Is he on extended dad duty? Let's examine the possibilities."
"mtv-news-uk","This is giving us some serious hair inspo"
"mtv-news-uk","Because you're not a true fan until you're showing your support all over your clothes."
"mtv-news-uk","He's said to be ""begging"" for the Keeping Up With The Kardashians star's forgiveness."
"mtv-news-uk","Savage x Fenty is already our favourite celeb line, and it's not even out yet."
"national-geographic","“No article we have ever published has been more difficult” than our first feature about the molecule of life, which appeared 42 years ago."
"national-geographic","The Trump administration has promised vast changes to U.S. science and environmental policy—and we’re tracking them here as they happen."
"national-geographic","Outdoor enthusiast Dylan McWilliams has had a rough few years, but he isn't turning his back on nature."
"national-geographic","To celebrate the 50th anniversary of the Wild &amp; Scenic Rivers Act, see 10 wondrous waterways that prove some things really do get better with age."
"national-geographic","Claire Rosen's dinner party creations reignite the magic of childhood."
"national-geographic","National Geographic’s prowess across platforms—particularly in virtual reality—helped it achieve the inaugural title."
"national-geographic","In many fields, sexual harassers have lost their jobs. But in the sciences, they’re often still getting paychecks instead of punishment."
"national-geographic","See dazzling developments spanning the world of science from archaeology to ecology to medicine."
"national-geographic","In this UNESCO World Heritage site, the sea lions come out to play."
"national-geographic","Quench your thirst in one of Europe's top cities for beer."
"new-scientist","The Gaia satellite has been scouring the sky for years. Over 22 months, it has located billions of stars and thousands of galaxies. Here’s what it found"
"new-scientist","The inhabitants of Sandby borg in southern Sweden were violently killed 1500 years ago, just decades after the collapse of the Western Roman Empire"
"new-scientist","The Bora people can encode complex messages into drumbeats that mimic human speech, and even include a “ringtone” to announce the start of a message"
"new-scientist","A series of smartphone tests that score memory and reaction are intended to make cannabis use safer and lead to a better understanding of the drug"
"new-scientist","A survey of the sun’s radiation turned up two surprises: a dip in low-energy gamma rays, and far more high-energy gamma rays than predicted. And nobody knows why"
"new-scientist","Cosmic rays, dust and stars swirl above a rocky cliff on the comet 67P. The images that make up this cool GIF were taken in 2016 by ESA's Rosetta spacecraft"
"new-scientist","One-eighth of the world’s 11,000 bird species are now threatened, and in most cases farming is the biggest threat thanks to our increasingly meat-rich diets"
"new-scientist","A man in the US who was injured by an exploding bomb in Afghanistan has become the first to receive a combined penis and scrotum transplant"
"new-scientist","A species of tropical ant builds traps on tree trunks that allow them to catch prey almost fifty times their size, by biting their legs and spread-eagling them on the tree surface"
"new-scientist","Two decades after it was first published, the chart linking carbon emissions and global warming is as relevant as ever, says Olive Heffernan"
"newsweek","The margin of Lesko's victory was narrow, giving hope to Democrats ahead of the mid-term elections."
"newsweek","Manafort was Trump's campaign manager from June 2016 until he resigned in August after his links to the Russia-allied Ukrainian government were revealed."
"newsweek","With an estimated number of 15,000 business schools worldwide, it becomes more and more challenging for prospective students to choose the right institution, especially as nearly 60 percent of future"
"newsweek","How much will the president's tweets and comments about Muslims play a role as Supreme Court justices hear oral arguments on the Trump administration's travel ban?"
"newsweek","City let a two-goal lead slip in the Manchester derby on Saturday (April 7)."
"newsweek",NA
"newsweek","Jay Crouch was able to eat food for the first time ever following the historic 10-hour procedure."
"newsweek","The shooting took place Tuesday evening at a Home Depot in northeast Dallas."
"newsweek","At least two officers were critically wounded."
"newsweek","“At least two doctors now have told us 'thank God you got her here when you did',"" the mother of 4-year-old Elianna Grace said after her daughter fell ill following a pool accident."
"new-york-magazine","Even Republicans are blaming Trump’s sloppy selection process for the latest scandal, and his contradictory response only added to the chaos."
"new-york-magazine","“If you’re a lobbyist who never gave us money, I didn’t talk to you.” Uh, are you supposed to just say that?"
"new-york-magazine","Including one hot sauce that was too scorching, even for me."
"new-york-magazine","Plus, nine other condiments and soup bases you’ll find in every Japanese kitchen."
"new-york-magazine","“I’m sure we’re all familiar with the expression about how there’s a special place in hell for women who don’t help other women … avoid camel toe.”"
"new-york-magazine","Marvel’s films have little in the way of a vision, but audiences have so much feeling for these characters that it doesn’t entirely matter."
"new-york-magazine","It’s a two-pronged affair with Emmanuel Macron leading the charm offensive and Angela Merkel talking tough."
"new-york-magazine","Ahead of season two, here’s your guide to the fictional patriarchy."
"new-york-magazine","It’s the pinky wiggle that really does it."
"new-york-magazine","Consider this your spring and summer ice-cream agenda."
"nfl-news","Former Dallas Cowboys Dez Bryant will have to wait until after the NFL draft to find his new home. NFL Network Insider Ian Rapoport reports Bryant isn't expected to sign until after the draft."
"nfl-news","Derek Carr got his first real taste of Jon Gruden's offense the Oakland Raiders opened veteran minicamp Tuesday. The quarterback said he hit the ground running."
"nfl-news","Dalvin Cook had a promising rookie campaign cut painfully short due to a left knee ACL tear after just four weeks. The Minnesota Vikings running back isn't about to let the injury affect a second season."
"nfl-news","Pete Carroll was criticized by ex-defenders Richard Sherman and Michael Bennett after being shipped out of town. This week Carroll fired back at that criticism."
"nfl-news","The speculation is over and we're done horsing around -- Rob Gronkowski is playing football in 2018. The tight end announced Tuesday he intends to return to the New England Patriots."
"nfl-news","Dez Bryant is out in Dallas, and he isn't returning. Cowboys owner Jerry Jones assured as much in speaking with reporters Tuesday, calling for a ""need to move on"" from their time together."
"nfl-news","Are the Cleveland Browns still considering their options at No. 1 in the draft? Chris Wesseling breaks down all the latest draft buzz, including Cleveland's supposed interest in Baker Mayfield."
"nfl-news","The Miami Dolphins exercised their fifth-year option on wide receiver DeVante Parker on Tuesday. The 25-year-old wide receiver is now under contract through the 2019 NFL season."
