"doc_id","text"
"the-telegraph","More than 400,000 households were vulnerable to hackers eavesdropping on their web browsing habits and credit card details thanks to a flaw in equipment from a British broadband provider."
"the-telegraph","A Tory minister has hit back at Boris Johnson&rsquo;s suggestion of an amnesty for illegal immigrants by insisting that they &ldquo;really shouldn&rsquo;t be here&rdquo;."
"the-telegraph","Kate Rothschild, the banking heiress, has been left devastated after burglars broke into her home and made off with half a million pounds worth of jewellery."
"the-telegraph","The Duke of Cambridge has fuelled speculation about the name of his new baby boy, telling a man who suggested he could suit Prince Alexander:"
"the-times-of-india","Cricket News: Having relinquished captaincy of Delhi Daredevils, Gautam Gambhir has decided to forego his entire Rs 2.8 crore salary while taking responsibility for"
"the-times-of-india","India News: NEW DELHI: Self-styled godman Asaram was sentenced to life in prison - until death - by a special trial court, which earlier today found him guilty of."
"the-times-of-india","India Business News: NEW DELHI: US President Donald Trump's proposed plan to withdraw work permits for H-1B visa holders spouses' (H-4 visa holders) has been opposed by th."
"the-times-of-india","India News: The Congress and others tweeted photos, clips of Narendra Modi with Asaram after the latter was found guilty of raping a minor. However, some on Twitt"
"the-times-of-india","India News: Two of the country's Union Cabinet ministers recently featured in two striking photographs.They are striking, because the ministers were the only wome"
"the-times-of-india","India News: NEW DELHI: The Congress and the BJP were engaged in a Twitter spat today after Karnataka chief minister Siddaramaiah labelled Prime Minister Narendra ."
"the-times-of-india","India Business News: NEW DELHI: Fraud-hit Punjab National Bank (PNB) has invited applications for empanelment of detective agencies to locate its untraceable borrowers as ."
"the-verge","Gmail’s biggest redesign is now live with the addition of many new features, including confidential mode, high-priority notifications on mobile, and a brand new Google Tasks app."
"the-verge","Amazon is bringing its proven Kids Edition formula to the Echo Dot, complete with a protective case and parental controls."
"the-verge","Google is the latest company to dump the pistol emoji for a watergun. This leaves Microsoft the only major OS left with a pistol emoji"
"the-verge","Avengers: Infinity War is massively entertaining, deftly incorporating dozens of characters across multiple storylines with a kinetic flair. After years of films where even the most mediocre heroes appeared to be invulnerable and indomitable, it’s an arresting jolt — and exactly the film the franchise needed.film the franchise needed."
"the-verge","After years of confusing options for saving tasks in Google’s ecosystem, the company is finally making an app."
"the-verge","Opera is releasing a new Android web browser today with a couple of clever interface choices meant to make it easier to use than other mobile browsers. It’s called Opera Touch, and the interface is designed around one-handed use."
"the-verge","OnePlus has announced the launch date of its upcoming flagship phone, the OnePlus 6. A showcase event will be held in London on May 16th."
"the-verge","Facebook has finally made its moderation guidelines officially available to the public in full. “Hate speech” is divided in three tiers and nudity has some oddly specific rules."
"the-verge","On The Late Show, Hank Azaria addressed the controversy surrounding The Simpsons’ Apu Nahasapeemapetilon, a character he voices that has been accused of being a racist caricature."
"the-verge","The new God of War gets a lot of things right: its complex characters, its thrilling story, and its innovative camera system. But it also nails the smaller stuff, too, like making Kratos’s new Leviathan Axe the most fun video game weapon in recent memory."
"the-wall-street-journal","Comcast posted strong earnings growth, despite its fourth straight quarter of cable TV subscriber losses, as the cable giant contemplates big acquisitions that could transform its business and roil its rivals."
"the-wall-street-journal","President Donald Trump faces growing pressure to resolve a dispute between the oil industry and the Farm Belt over ethanol mandate."
"the-wall-street-journal","A large part of North Korea’s underground nuclear test facility is unusable due to the collapse of a cavity inside the mountain after the latest test-detonation occurred, according to Chinese seismologists."
"the-wall-street-journal","Moves to ease post-crisis rules are spurring lending and risk-taking at a time when the industry is lowering its own standards amid a near-record economic expansion."
"the-wall-street-journal","Insurers are expected to roll out new “skinny” health plans that offer a cheaper alternative to Affordable Care Act coverage to consumers who buy their own insurance. But critics say buyers may be risking big bills if they get sick. This video looks at the new plans’ potential winners and losers."
"the-wall-street-journal","Consumer-staples stocks have fallen 13% this year as investors once attracted to the steady payouts of companies selling goods like breakfast cereal, toothpaste and razors shop elsewhere."
"the-wall-street-journal","Takeda is near a deal worth more than $60 billion to buy European drugmaker Shire, having raised its bid four times in a sign of how ardently Japan’s legacy companies are pursuing growth abroad as sales at home slow."
"the-wall-street-journal","For its Gmail redesign, Google put tasks, calendars, notes and email on a single screen, so now you can live your whole work life in one app."
"the-wall-street-journal","Whether dozens of convicted terrorists set to be released from U.S. prison in the coming years can stay out of trouble is an issue that’s posing new challenges for courts. With limited data on recidivism for terrorism-related crimes, experts say the current system is inadequate in assessing how much of a risk they pose."
"the-wall-street-journal","Ronny Jackson, the White House doctor nominated to run the Veterans Affairs department, will continue to seek confirmation despite concerns about his performance and behavior in his current job that were publicly aired Tuesday."
"the-washington-post","A spokesman said Ronny Jackson, whose nomination has been questioned by lawmakers from both parties, is ‘exactly what’s needed’ at VA."
"the-washington-post","Allegations of professional misconduct prompted senators to postpone his hearing — and to question the White House vetting process."
"the-washington-post","Trump’s controversial picks for CIA and Veterans Affairs are a perfectly timed gift to Democrats who argue nominees need as much time as possible for review, not less"
"the-washington-post","OMB director says he only met with lobbyists who gave money while he was in Congress."
"the-washington-post","Drain the swamp?"
"the-washington-post","The president himself made it a point to highlight the first lady's efforts during his opening toast."
"the-washington-post","The first lady’s Chanel haute couture gown at the state dinner couldn’t compete with the chapeau."
"the-washington-post","President Trump and first lady Melania Trump host their first state dinner in honor of French President Emmanuel Macron and his wife, Brigitte."
"the-washington-post","Justices on Wednesday review whether ban was to protect, or to fulfill anti-Muslim campaign promise"
"the-washington-post","Panel chaired by Condoleeza Rice says players should be permitted to speak with agents and those undrafted should be allowed to return to school."
"time",""
"time",""
"time",""
"time",""
"time",""
"time",""
"time",""
"usa-today","Travis Reinking's brushes with the law reveal a pattern of mental instability but also show the limits of removing guns from people whose mental illnesses could pose a risk to the public."
"usa-today","A lack of planning and knowledge leave many Social Security recipients with smaller checks in retirement."
"usa-today","Google's email service Gmail gets its biggest update since 2011. Here are six of the features you will change how you use it."
"usa-today","Antonio Callaway was one of nine Florida players suspended during the 2017 season while being investigated for fraud."
"usa-today","While the kind of work one finds fulfilling is subjective, there is no debate about which jobs pay the most. High-paying jobs are high paying for a reason, highly specialized and often require advanced education. Here's a review of the latest median pay data from the U.S. Department of Labor."
"usa-today","Vive la France, says the first lady, resplendent in a Chantilly lace couture gown."
"usa-today","A federal judge Tuesday gave the Department of Homeland Security 90 days to respond."
"usa-today","Melissa McCarthy's R-rated puppet murder mystery was guilty of making CinemaCon crack up on Tuesday."
"usa-today","Finland's basic income trial failed."
"usa-today","President Trump's campaign promises, statements and tweets are center stage as his immigration travel ban reaches the Supreme Court."
